646.	NO-EMOTION	The article cites a recent strategic memo to national GOP Party Chair Ken Mehlman from Market Strategies, which highlights polling (granted, six-week old polling) showing the base is in line and ready to hit the polls.
647.	NO-EMOTION	Is this spin or is it true?
648.	NO-EMOTION	Obviously no way to tell at this point, but any Democratic victory strategy that assumes weak Republican turnout as a key to winning is folly.
652.	NO-EMOTION	In other words, the mantra for Democratic candidates this political season: persuade everyone you can, turn out your base, and assume all the other guy's usual folks will vote.
653.	NO-EMOTION	In other words Democrats, work like hell until November 7th.
654.	NO-EMOTION	i feel like i could fly.
656.	HAPPINESS	with a smile ofcourse.
659.	NO-EMOTION	ive come to realise also how different i am with him.
660.	NO-EMOTION	not different me or anything, different in how i am in OUR relationship, compared to my others.
661.	NO-EMOTION	and im sure he's been doing the same.
663.	NO-EMOTION	and we're both being the best we can for each other, and it shows, and it pays off.
665.	HAPPINESS	we're friends and lovers and everything inbetween that.
666.	NO-EMOTION	we have come such a far way in such a short time and i look forward to every other moment i will share with him.
668.	NO-EMOTION	i am his all his already, i know this and i hope he does too.
669.	NO-EMOTION	i want to be everything he needs and more.
670.	NO-EMOTION	and ive learned from my past relationship what to do and what not to do and watching what i say and how i say it and.
671.	NO-EMOTION	ALL these things, im more aware of the relationship and it status and im not ,.
672.	NO-EMOTION	i duno, im kinda losing track of wht i want to say here.
674.	NO-EMOTION	i better not, considering the circumstances.
676.	FEAR	so no i wont have my head too high up my ass about it, but im noot going to sit here and think/dread it everyday either.
677.	HAPPINESS	i will cherish him ad love him and let him know im there and i care for him everyday that we have together.
682.	NO-EMOTION	somehow.
683.	NO-EMOTION	its completely unlike anything i had with chris, rerally, but jamie has a lot of personality like chris did.
687.	SADNESS	stephen was a little abusive, mainly with words and feelings directed at me / to make me feel bad.
688.	ANGER	chris had a problem with words too,and his anger.
690.	NO-EMOTION	he could car eless about anything and everything as long as he got his way everything was alright.
691.	ANGER	other than that hed get offended or pissed off or ignorant about it.
692.	ANGER	stupid ass hole!
693.	ANGER	gudam, why did i waste so much time on his sorry ass?
694.	NO-EMOTION	can someone tell me please?!
695.	NO-EMOTION	oh yeh, i was sub-conciously restraining myself and waiting for Jamie >:)~
696.	NO-EMOTION	Let's try and finish Sunday now for the third time, before it is Sunday again!
697.	NO-EMOTION	After church I went to one of my best friend's house for lunch.
698.	NO-EMOTION	My mother was invited too.
699.	NO-EMOTION	I saw the guy I went to a dance with once back at school there at her house.
700.	SURPRISE	Haven't seen him in ages.
701.	NO-EMOTION	It's her brother's best friend.
702.	NO-EMOTION	Goes figure he'd be there.
703.	SURPRISE	Hm, was a bit weird.
704.	NO-EMOTION	Anyhow not important though.
705.	HAPPINESS	We had a good lunch with Gino Genelli ice-cream!
706.	ANGER	(However you spell the Genelli part) Ah, we talked about Anri's ex and her mom mentioned how Anri was angry with her dad the one time the ex visited, cos her dad kept him busy most of the day.
707.	NO-EMOTION	Oh ya we were talking about Land Rovers!
708.	ANGER	Anyhow her dad asked her then at the table but why would you be angry with your dad.
710.	HAPPINESS	"Whahahaha" I nearly cracked myself and don't think I didn't blush.
711.	NO-EMOTION	W0rd!
713.	HAPPINESS	That was funny.
714.	HAPPINESS	Everyone at the table was giggeling.
715.	NO-EMOTION	W0rd I am dead tired!
716.	NO-EMOTION	Gonna push through with this!
717.	NO-EMOTION	Then Anri wanted to go the beach, cos she just visited for the weekend and has to go back to where she studies in another suburb like hunderds of km's away from the ocean.
718.	NO-EMOTION	Her niece and Lizelle came along.
719.	NO-EMOTION	We went in my car, cos apparently I have music.
720.	FEAR	That be the only reason, cos everyone is scared of driving with me. >.> Don't ask.
721.	NO-EMOTION	:P I drive well now though, yep I do!
722.	NO-EMOTION	We sat on the beach and mostly I felt like sleeping.
723.	NO-EMOTION	but don't think they would let you do that.
724.	NO-EMOTION	NooooOOoo.
725.	NO-EMOTION	I took lots of photo's!
726.	HAPPINESS	Now that was fun.
727.	NO-EMOTION	Will try and upload them somewhere or do something or I will see!
728.	NO-EMOTION	Okies!
729.	NO-EMOTION	I took photo's of this little girl swimming in the ocean.
730.	NO-EMOTION	The water is freezing cold by the way and it is winter and we sat there dressed warmly!
731.	NO-EMOTION	Somehow Anri got the idea in her head that I had to go test the water so that she can take photo's and like that was not enough I had to throw Baywatch moves.
732.	NO-EMOTION	You know that Baywatch running style from that tv program.
734.	HAPPINESS	Funny photo's came out there.
735.	NO-EMOTION	I wanted to take photo's of Kiteboarders, but there were none!
736.	NO-EMOTION	Just guys flying their kites.
737.	NO-EMOTION	=/ And some guy on a prepelled engine driven kite thing that was in the air.
738.	NO-EMOTION	o.O Took a photo of him, he was a bit far though.
740.	NO-EMOTION	I would like to just walk around or sit somewhere where lotsa people are and take photo's of them, especially like action photo's!
741.	HAPPINESS	LOVE IT!
742.	NO-EMOTION	It is like doing my art.
743.	NO-EMOTION	I get lost in it.
744.	NO-EMOTION	I totally zone out.
745.	NO-EMOTION	We went to Anri's house for cake and coffee.
746.	NO-EMOTION	Hmmm.
747.	HAPPINESS	cake ^.^ ICE-CREAM!
748.	HAPPINESS	Coffeee and dark chocolate!
750.	NO-EMOTION	Lizelle wanted to go to the movies and I wanted to go to church and Anri I don't know what.
751.	NO-EMOTION	We sat there 'trying to decide' what we are going to do.
752.	NO-EMOTION	We almost sat there for an hour.
753.	NO-EMOTION	Lizelle didn't want to go to church.
754.	NO-EMOTION	That was as clear as daylight.
755.	NO-EMOTION	So we basicly had to wait for Anri to decide.
756.	NO-EMOTION	Hm.
757.	SADNESS	Really sad how we can actually sit and wonder in your one hand is God and the other hand is a movie.
758.	NO-EMOTION	what do you pick.
759.	NO-EMOTION	(Non-christians, don't worry about this part I am just expressing my thoughts, doesn't mean I don't accept you still as a person, just kinda thinking out loud to people that believe the same as me.) Hmmm.
760.	HAPPINESS	so we went and it was nice to be there!
761.	NO-EMOTION	:p
762.	NO-EMOTION	They went to the movies afterwards.
763.	NO-EMOTION	Anri promised to come to my house after the movie to keep me awake while I work.
764.	SURPRISE	Didn't think she would do it, but hey!
765.	NO-EMOTION	I sat there drawing and uhm the phone rang and it was the police.
766.	NO-EMOTION	Ye.
767.	NO-EMOTION	I am too tired now.
768.	NO-EMOTION	will finish later
769.	NO-EMOTION	I want to pose a serious question to anyone out there that chooses to read this.
770.	NO-EMOTION	If you were given the choice between life and death, which one would you choose?
771.	DISGUST	No, I'm not a stupid chick for those of you that may be wondering.
772.	NO-EMOTION	The choice does seem quite obvious to me. But what if you knew you were gonna die, like possibly sooner than later, for whatever reason.
773.	NO-EMOTION	Would you be careful and try to preserve every moment you have left?
775.	ANGER	I have a friend that is gonna die, probably sooner than later, and I was angry because some of the choices he has made in the last few years have cut his time down to virtually nothing.
778.	NO-EMOTION	So I tried to step out of myself for a minute and look at things the way he may have been viewing them.
779.	NO-EMOTION	Imagine you are young and healthy.
780.	NO-EMOTION	An athelete.
781.	NO-EMOTION	The whole world and it's endless possibilities are stretched out before you.
782.	HAPPINESS	You have wonderful friends that love and cherish you.
785.	NO-EMOTION	You are virtually unstoppable.
786.	NO-EMOTION	All you have to do is decide which opportunity you would like to take advantage of first.
787.	SURPRISE	Then things start to take a turn in an unexpected direction.
789.	ANGER	Think constant arguing, lies and deception, money mismanagement, and infidelity.
792.	NO-EMOTION	So you decide to join the military.
793.	NO-EMOTION	You figure, 'Hey, I might as well use this opportunity to see the world, make some money, and get an education and a marketable skill.'
794.	NO-EMOTION	The world is still yours for the taking.
795.	NO-EMOTION	So you make an appointment with a recruiter for an interview and physical.
796.	NO-EMOTION	Everything goes well with the interview.
797.	NO-EMOTION	The recruiter tells you that the technology field in which you are interested is growing rapidly and there are all types of jobs available that you can parlay into a lucrative career once you retire from the service.
798.	NO-EMOTION	You leave there with a renewed sense of purpose and vow to take full advantage of this experience.
799.	NO-EMOTION	You go home, wait two weeks, then return to the recruiter's office for the results of your background check and physical.
800.	SADNESS	The recruiter comes in the office with a look of sadness and disappointment.
801.	NO-EMOTION	You think to yourself that maybe you had too many traffic tickets, or maybe there was something small in your past that has presented you from being selected to join the military.
802.	NO-EMOTION	The look on the recruiter's face is unmistakable.
803.	SADNESS	You begin to prepare yourself to hear bad news and immediately go into self preservation mode to plan out your next move.
804.	SADNESS	He begins to speak while you're planning, "I'm sorry to have to tell you this(ok, I can move back home for a while and go back to school and work on my degree.
805.	NO-EMOTION	), but we won't be able to welcome you into the Armed Forces(or I could do some traveling and explore the country.
806.	NO-EMOTION	We have the results from your physical(I know, I'm gonna do some volunteer work with kids in the community.
808.	NO-EMOTION	So what do you do?
809.	DISGUST	This is the story as it was given to me, and when I heard it I was pissed.
810.	NO-EMOTION	First, because I could already piece together the backdrop of the story.
813.	NO-EMOTION	See, I knew he had cheated.
815.	HAPPINESS	lol).
816.	NO-EMOTION	But he assured me that he had used a condom and that I was the only one that he was having unprotected sex with.
817.	SURPRISE	So imagine my surprise when I was about to engage in activities with him and saw an of color coming from you know where.
819.	NO-EMOTION	She then tells me that she's gonna test me for gonorrhea, but also that she's gonna have to test me for HIV.
820.	SURPRISE	I'm like, "For what?"
821.	NO-EMOTION	She tells me that if I was with a person that was infected with gonorrhea, what makes me think that person didn't have anything else?
822.	NO-EMOTION	I couldn't answer her.
823.	SURPRISE	Really, what did make me think that?
825.	DISGUST	I would have given this man, who obviously had little regard for me, my life in exchange for his bullshit and lies.
826.	HAPPINESS	Fortunately, my test results came back negative for both gonorrhea and HIV.
827.	HAPPINESS	I was of course thankful, but I realized something very important during that time.
828.	DISGUST	I realized that my life belongs to me. Fuck the bullshit.
829.	ANGER	The second reason I was pissed was because not only was my friend is dying from this disease and has had it the entire time that we have been friends, but to my knowledge has not taken the appropriate care of himself that a person with HIV should be taking.
830.	NO-EMOTION	He never went to see an infectious disease specialist.
831.	NO-EMOTION	He never took any medications other than a multi-vitamin.
832.	NO-EMOTION	He partied just as hard as I did, drank and smoked just as much weed as me. So after I learned of his condition, I thought to myself, "Is my friend trying to die?"
833.	NO-EMOTION	When we first became friends he was an athelete, so he was pretty fit for the most part.
834.	NO-EMOTION	I had never known to do much of anything unhealthy and he was one of those health conscious, work out fanatics.
835.	NO-EMOTION	Maybe he maintained that lifestyle in the beginning because he thought that he could somehow combat his illness this way.
836.	SURPRISE	I wonder what changed his mind about that?
837.	NO-EMOTION	Could it be that he realized that no matter what he did, there was nothing that would get rid of his disease, so he lived and played hard and masked his pain with lots of partying, drugs, and lots of random, annonymous sex?
838.	NO-EMOTION	I've asked him about this, and he has never really given me an answer.
839.	SURPRISE	But I think about it alot, and I wonder exactly when did he decide to die?
840.	NO-EMOTION	I wonder how many other people have made the same decision that he made.
841.	NO-EMOTION	I wonder what choices I would have made differently had that nurse from the clinic given me different results.
842.	NO-EMOTION	So what would you do?
843.	NO-EMOTION	Would you choose to live, or would you choose to die?
844.	NO-EMOTION	The question itself is mostly rhetorical, presented to raise awareness and provoke thought moreso than response.
845.	NO-EMOTION	However, if you are so compelled to do so, please leave your thoughts and comments.
846.	NO-EMOTION	All will be greatly appreciated.
847.	NO-EMOTION	my birthday is on monday.
850.	ANGER	im going to be trashed.
851.	DISGUST	even tho i have work on monday which is my bday cause shop rite sucks my dick.
852.	HAPPINESS	im usually always so pumped for my bday.
853.	NO-EMOTION	but right now its just reminding me that everyones leaving me.
854.	NO-EMOTION	i seriously dont know what i am going to do at all.
855.	NO-EMOTION	and everyone thats home is so wrapped up with their own stuff ///dudes//women.
856.	DISGUST	it just sucks when everything youve known for years just disappears.
857.	NO-EMOTION	alfkjaslkjfasjflka;sjdf;asjfals;fjlakjsf.
858.	NO-EMOTION	im done talking about it.
859.	SADNESS	i miss myrtle beach.
861.	SADNESS	i cried on the way home from myrtle.
862.	NO-EMOTION	for many reasons.
863.	NO-EMOTION	nothing hereee.
864.	SADNESS	im hearbroken &lt;/3.
865.	NO-EMOTION	myrtle&lt;/3
866.	NO-EMOTION	i just do not want to live at home anymore.
867.	NO-EMOTION	its not bad here at all.
868.	ANGER	im just annoyed.
869.	NO-EMOTION	but nobody else is for moving out as much as i am.
871.	NO-EMOTION	good b/c i def dont have the money to move out right now.
872.	NO-EMOTION	bad b/c i want to move out mother eff.
873.	NO-EMOTION	all my substitute information is in.
874.	NO-EMOTION	if i can get a job at taylors.
875.	NO-EMOTION	maybe things wont be so bad.
876.	NO-EMOTION	and i can get a new car.
877.	NO-EMOTION	then convince someone to move out with me.
878.	FEAR	since everyone i wanted to get an apt with is now moving 29857938475 miles away all b/c of a freaking deadline.
879.	NO-EMOTION	fags.
880.	NO-EMOTION	////the way you look at me////
881.	NO-EMOTION	im feeling you
882.	NO-EMOTION	gnite darlins
883.	NO-EMOTION	i have work in the am.
1.	NO-EMOTION	Well, well, well.
3.	HAPPINESS	Hahaha!
4.	SURPRISE	Well, I'm surprised that I actually found it.
5.	NO-EMOTION	Jake's directions to the schools LJ account was wrong.
6.	NO-EMOTION	so I searched for it and finally found it.
7.	NO-EMOTION	You can't trust Jake's directions to his own bathroom in his own dorm room!
8.	HAPPINESS	Hahaha!
9.	NO-EMOTION	So, drop by and tell me what all of you are up to!
10.	SADNESS	I so missed all the cool people I met at SHS!
11.	NO-EMOTION	I've been thinking a great deal about the importance of ritual.
12.	NO-EMOTION	Not religious ritual (like baptism) or societal ritual (like shaking hands), but personal ritual.
13.	NO-EMOTION	I've been wondering which aspects of a behavior determine whether it's ritual or rut.
14.	NO-EMOTION	And how I can possibly develop more rituals and fewer ruts in my life.
15.	NO-EMOTION	This has all come about because lately, I've been thinking about the Big Picture.
16.	NO-EMOTION	Granted, not the global, world-issues Big Picture, just MY Big Picture.
17.	NO-EMOTION	The same thought keeps coming back to me: I lived my first 40 years largely as a leaf, blowing about in the wind.
18.	NO-EMOTION	Like that bag in American Beauty.
20.	NO-EMOTION	it was not self-determined.
21.	NO-EMOTION	I want the next 40 years to be lived on purpose.
22.	NO-EMOTION	How do I do that?
23.	NO-EMOTION	And how can I start now?
24.	SURPRISE	One of my most surprising observations about this whole ritual thing is how much easier it was to establish new rituals when I was on location, as opposed to being at home.
25.	NO-EMOTION	And, the corollary: how easy it is to slip into old habits, once back at home.
26.	NO-EMOTION	[It makes sense that there is concern for addicts or alcoholics who successfully gets straight or sober some place other than where they live.
27.	NO-EMOTION	and then eventually have to return home to old triggers.]
28.	NO-EMOTION	So anyway.
29.	NO-EMOTION	Ritual.
30.	NO-EMOTION	Rut.
32.	NO-EMOTION	That, and they may not be exactly great for you.
34.	NO-EMOTION	I'm not advocating all-structure, all-the-time or anything.
35.	FEAR	But I do know the perils of a life devoid of ritual.
37.	NO-EMOTION	At least in my experience.
38.	NO-EMOTION	I'd like to say that my rituals are more active and crunchy.
39.	SADNESS	but alas, they aren't (yet).
40.	NO-EMOTION	Here are some rituals I HAVE managed to cultivate:
41.	NO-EMOTION	* Every day when I come home from work, the first thing I do is put on my pajamas.
42.	NO-EMOTION	Maybe that doesn't sound like a ritual.
43.	HAPPINESS	but when I started thinking about things I do regularly that I enjoy, that's definitely one of them.
44.	NO-EMOTION	* Every other Saturday, Catharine and I get manicures and pedicures.
45.	NO-EMOTION	A time to relax, be pampered, catch up.
46.	NO-EMOTION	and we come away with the cutest toes ever!
47.	HAPPINESS	* A ritual I absolutely adore is going to the outdoor screenings at the Hollywood Forever Cemetery during the summer.
48.	NO-EMOTION	There are all sorts of mini-rituals that go into this regular event, including the collection of picnic dinner items and the precision methodology by which one gets the perfect spot on the lawn.
49.	HAPPINESS	* When I'm NOT working, I have been known to take myself to brunch on the weekends: just me and whatever novel I'm currently enjoying.
51.	NO-EMOTION	Maybe after this show ends, I'll be able to start a new garden.
52.	NO-EMOTION	I've just realized in trying to make a list of my rituals, that I really don't have many.
53.	NO-EMOTION	How very telling.
54.	SADNESS	This is not good.
55.	NO-EMOTION	When I imagine the rituals of others, things like a daily, morning run (something hard for me to fathom, I admit), meditation, feeding the ducks on Thursdays, after-dinner strolls with your family, poker night, date night.
56.	NO-EMOTION	and the like are what come to mind.
58.	HAPPINESS	* I'm happy to taste any new flavor of ice cream (I love to try new flavors!), but when it comes to ordering, it's always Mint Chip.
59.	NO-EMOTION	Always.
60.	NO-EMOTION	and.
61.	FEAR	* My fear of insomnia keeps me from going to bed when I'm really tired.
62.	NO-EMOTION	Is that a rut.
63.	NO-EMOTION	or just something totally mental that I do?
64.	NO-EMOTION	Anyway, I don't want to sully this post with MY list of rituals and ruts.
66.	NO-EMOTION	How do you think we can instill more meaningful rituals into our lives?
67.	SADNESS	"The image of cartoonist after cartoonist sitting at folding tables selling comic books is truly a pathetic one.
68.	NO-EMOTION	From talking with cartoonists, I get the sense that most of them find it debilitating, too.
70.	SADNESS	It can be ego-crushing when no one comes to buy anything.
72.	HAPPINESS	- Bart Beaty, whom I had the pleasure of meeting at the show, from his Conversational Eurocomics column on what SPX could learn from some European conventions
73.	HAPPINESS	I really enjoyed myself at SPX, that delightsome Bethesda megamall of rare and exclusive purchases and the men and women who brought the wares about.
74.	NO-EMOTION	Don't sweat it, that's just my perception: I traveled the hour and a half trip down on Saturday with American Hero Chris Mautner (he attained that storied status by agreeing to drive), arrived a half-hour after the doors opened, stayed until 5:30, then went right back home.
75.	NO-EMOTION	That means I didn't see the Ignatz Awards, didn't partake of any post-show gatherings, and missed a big chunk of panels.
76.	NO-EMOTION	My SPX, in other words, was full of shopping and stalking the aisles.
77.	NO-EMOTION	Commerce!
78.	NO-EMOTION	Show debuts!
79.	DISGUST	I met an awful lot of fine creators, but I hated taking up much of their table time; heaven knows by the afternoon there's a swarm of people waiting to trudge through the byways between tables, and one thousand distractions to attend to.
80.	NO-EMOTION	I'd never been to a comics show in my life, so I'd not known any SPX other than what was presented to me there: a pretty swank hotel, a table to pay at in the hall outside, and big ballroom with everyone selling everything inside, and a bunch of other rooms to have educational and informative events in, though all of those were down the hall, around the bend, and down an escalator.
81.	NO-EMOTION	There were no signs to direct you to the panels or whatnot, though it wasn't hard to find someone to ask direction of.
82.	NO-EMOTION	Still, the separation-by-floor carried a certain symbolism for me when coupled with the atmosphere; upstairs was the carnival of monies and tables, downstairs were the talks and trophies.
83.	NO-EMOTION	Upstairs there were masses of shoppers with bags and backpacks and totes, cookies and candies and muffins on certain tables to attract attention, and even a pair of folks operating hand puppets to entice a stray passerby.
84.	NO-EMOTION	Downstairs there were hushed people crouched before open doors, the portals leading to capacity talks.
86.	NO-EMOTION	All of it in a building off the highway, malls and fences and the whipping metal sea of vehicles all around it.
87.	NO-EMOTION	To say there was no color at all would be misleading, since it was a nice day and there were a number of trees and things, but I did not detect any local pulse at all.
88.	NO-EMOTION	It was a hotel, on a road.
89.	NO-EMOTION	I went out for lunch with Chris and Gina Gagliano of First Second; food became curiously hard to find within hiking distance (in the interests of full disclosure, my mastery of direction also had us walking the wrong way for a good while).
90.	NO-EMOTION	After we passed by a large parking lot promising a furniture blowout sale, as well as a haunted attraction and possibly ponies or something in the back, we decided to turn around and stop at a little diner we'd passed on the way.
92.	NO-EMOTION	But we didn't hang around.
93.	NO-EMOTION	We hurried back from the gray highway to the center of comics and people, followed close behind by haunted ponies who'd just bought cheap Barcaloungers for their ghost stable and were now jonesing for independent comics.
95.	HAPPINESS	I love walking around for things to buy, and traveling less than two hours to arrive at the comics spread of my dreams won't raise too many personal hackles, let me tell you.
96.	NO-EMOTION	I also made it a point to say hello to everyone there with whom I'd ever communicated on the internet, though I couldn't find anyone matching Johanna Draper Carlson's description and I totally missed Douglas Wolk.
98.	HAPPINESS	I'm also really glad I had Chris with me, since he knew a lot of faces that I didn't; he made a fine guide, though one of us would occasionally wander away from the other in the vein of the old NES version of Who Framed Roger Rabbit?, though I'm unsure as to which one of us was Bob Hoskins.
99.	NO-EMOTION	Actually, I think maybe the best thing about SPX is how everyone is kind of pressed together, comics placed near one another seemingly without much concern for subject matter coherency (I heard it was a bit different in prior years, with multiple selling rooms and all); if the creators in attendance and the books on display weren't a comprehensive picture of English-language non-superhero comics, there was at least enough diversity to manage the illusion of comprehensiveness.
100.	NO-EMOTION	A diverse audience too, everything from young to old, from old-school nerds to stylish-looking folk, from aged hippies to teenage Goths.
101.	NO-EMOTION	To look only at this crowd, you'd imagine that there was no question as to the diversity of the comics-reading audience.
102.	NO-EMOTION	I went to two panels, Scott McCloud's and Brian Chippendale's.
103.	NO-EMOTION	There was nowhere to sit in the former, since I got there late, so I sort of drifted in and out of hearing distance.
104.	NO-EMOTION	At one point, McCloud began vigorously drawing a chart to illustrate different types of artists, all the while telling stories of the message board clashes between forces on places like the Comics Journal board.
105.	NO-EMOTION	Someone behind me turned to someone else and whispered "It's just like Civil War."
106.	NO-EMOTION	Afterward (a solid half-hour afterward, I believe), McCloud could be seen out in the hallway, taking questions from anyone who happened to want to talk to him away from the bustle of his table upstairs.
