328.	HAPPINESS	Not that Erin has a problem, she loves kids and works with them, but I've never honestly been much of a kid person.
329.	NO-EMOTION	Older kids, sure, I can identify with short, immature but otherwise rational human beings, but little kids?
330.	NO-EMOTION	I have no clue.
331.	NO-EMOTION	What do I do when someone three feet tall smacks me in the head?
332.	ANGER	You can't beat them, you can't yell and foam at the mouth, but you can't ignore it either.
334.	ANGER	But unlike that said territory, children grow-up at some point, and most at least realize that you can't just go around pissing people off.
335.	NO-EMOTION	Though they undoubtedly do.
336.	DISGUST	The movie itself sucked.
338.	DISGUST	Tricky bastards.
339.	ANGER	The plot was just full of loopholes, there wasn't even any gratuitous boobage that you might otherwise associate with a Hollywood movie that stars an entire cast of nothing but athletic women.
340.	NO-EMOTION	No, these weren't the "oh I'm cute, see my ta-tas?" kind of athleticly built women, these were the "see me hang from the roof of a cave by my fingernails" type, the "I don't even need a sportsbra" kind of actual athletes.
342.	ANGER	But this one was just full of plot holes that you could drive a truck through.
343.	NO-EMOTION	Spoiler warning!
344.	NO-EMOTION	IF you actually want to see "The Descent" then stop here and go do your nails or something.
345.	NO-EMOTION	Ok, so at one point they find a dead moose in the middle of the cave system.
346.	NO-EMOTION	How did it get there?
347.	NO-EMOTION	"Oh they kill the food outside and bring it inside to eat."
348.	NO-EMOTION	Umm-kay, I can see that.
349.	NO-EMOTION	But on each side of this cavern, there are drop-offs of hundreds of feet that had to be traversed by clinging to the ceiling.
351.	DISGUST	So how the holy fuck did the cave-dwellers get a MOOSE through?
352.	NO-EMOTION	And what about the primitive cave paintings by the local natives thousands of years ago?
353.	NO-EMOTION	How did they traverse the chasms?
354.	NO-EMOTION	Would they bother?
356.	NO-EMOTION	"Hey shelter" you think, good deal.
357.	SURPRISE	You explore for a little bit, then WHOOPS!
358.	NO-EMOTION	No floor!
359.	NO-EMOTION	Is your first thought "well, must find a way across?"
360.	NO-EMOTION	What about the tiny passages you'd have to squeeze through?
361.	NO-EMOTION	What's the point?
363.	NO-EMOTION	I don't find the idea of poking around in the dark deep in the bowels of the earth very entertaining at all, I don't think our ancestors, devoid of electric flashlights and safety equipment would be any more inclined to risking their life for so worthless an enterprise.
364.	NO-EMOTION	Is there food that deep in the cave?
365.	NO-EMOTION	Fresh water?
366.	NO-EMOTION	Safety?
367.	ANGER	Hell no.
368.	NO-EMOTION	So what's the point?
369.	NO-EMOTION	If this took place in the wilds of Africa, perhaps it might be worth venturing into the earth to escape the large predators that prayed upon human beings so very long ago, but even that was well before we took to cave drawing.
370.	DISGUST	After the movie and the subsequent discussion as to all the different ways it was just simply retarded, we came back to the house and watched TiVo.
371.	NO-EMOTION	Holly's gotten really into Dog the Bounty Hunter and we watched an episode of that.
372.	HAPPINESS	It's alright, it's like American Choppers in that I enjoy it if there's really nothing else to watch.
373.	NO-EMOTION	We also caught a couple episodes of that new Stan Lee show about the wanna-be super heros on SciFi.
375.	NO-EMOTION	I'm already convinced that Feedback will win, he just looks the part of a modern comic book figure.
376.	HAPPINESS	Major Victory is entertaining, but he's got an old-school look to him, like the original Batman or Superman.
377.	NO-EMOTION	Comics and subsequent spin-off media such as movies reflect the point I'm making: the whole shebang has gotten darker, both literally and figuratively.
378.	NO-EMOTION	Black suits for Spiderman and Superman for instance.
381.	NO-EMOTION	Look at Superman: the original television Reeves was a fatman in tights with no issues, his movie successor had human flaws and frailties.
382.	NO-EMOTION	Spoiler alert!!
384.	HAPPINESS	Cue "Our Lady Peace - Superman's Dead", good song.
385.	FEAR	"Do you worry that you're not liked?
386.	NO-EMOTION	How long til you break?
387.	HAPPINESS	You're happy cause you smile, but how much can you fake?
388.	NO-EMOTION	An ordinary boy, with an ordinary name, but ordinary's just not good enough today."
389.	NO-EMOTION	Yea ok, so I don't know what this has to do with the refrain, but it's a catchy tune.
390.	NO-EMOTION	We watch tube for a few hours, I watch Holly fold clothes, I head to bed in the basement then get up the next morning to watch Spiderman 2 with her and the kids.
391.	NO-EMOTION	Then I head home around lunch time.
393.	DISGUST	The turnpike was nuts, every asshole from Jersey and Connecticut was apparently heading to Canada.
394.	NO-EMOTION	It was so packed that all three lanes were barely crawling along at the speed limit, let alone any faster.
395.	NO-EMOTION	At about Biddeford, I jumped-ship and headed up Route One, expecting an "accident" the likes of which I experienced the last time I headed home from NH by myself.
396.	NO-EMOTION	Imagine: three lanes of traffic, none of it moving, for the better part of two hours.
397.	NO-EMOTION	Come Scarborough, I jumped back on, since Route One was pretty packed, and I didn't want to go through downtown Portland.
398.	NO-EMOTION	I abandoned the turnpike last time as well, shortly after the traffic jam cleared, and ended up getting home 4 hours later than expected and having just enough time to get ready for work before heading out again.
399.	DISGUST	It kind of sucked.
400.	ANGER	So back on the pike, putting up with traffic, speeds picked up to well above where they should have been, things cleared a little north of Lewiston, a little more above Augusta, but it was still pretty frigging busy all the way up.
401.	NO-EMOTION	Got into Bangor, picked up my check, went home and waited for Erin.
402.	NO-EMOTION	Spent some time with her, watched a little "Storm of the Century" on DVD (the bargain bin rules), then took a nap before work, where I am now.
403.	NO-EMOTION	How can I blog so extensively at work?
404.	NO-EMOTION	The new guy is still training, and since he goes live on his own next weekend, he needs to ensure he can actually do the job on his own.
405.	DISGUST	So I'm not doing shit unless absolutely necessary.
406.	NO-EMOTION	Yes, in effect, I've become a Supervisor.
407.	HAPPINESS	I'm so proud of myself.
408.	NO-EMOTION	Sniff.
409.	NO-EMOTION	Pete Rose runs over Indians catcher, Ray Fosse to score the winning run of the 1970 All Star Game.
410.	NO-EMOTION	Fosse's career was never the same.
411.	NO-EMOTION	Teams---1---2---3---4---5---6----Final
412.	NO-EMOTION	Nick------1---0---1---12--2---2----18
413.	NO-EMOTION	Marco----2---2---1---1---7---0----13
415.	DISGUST	Yeah, cocky, supercilious Marco Starnoni who eats as if he had been walking in the desert feasting on nothing but manna for forty years.
416.	NO-EMOTION	Well, it was an all right game.
417.	NO-EMOTION	We scored twelve runs in the 4th inning because of some shoddy defense by Marco's team.
418.	NO-EMOTION	Let's just say they gave us at least five outs but probably more.
419.	NO-EMOTION	The inning would just never end.
421.	NO-EMOTION	I had quite a few homeruns and was involved on the wrong side of a great defensive play turned in by Joe Twarogowski.
422.	NO-EMOTION	In the 3rd inning, I tried to score when a throw to third base got away.
423.	NO-EMOTION	I came racing down the line as Ryan Shalek picked up the loose ball and fired a strike to home plate.
424.	NO-EMOTION	Joey, who was blocking home plate, reached up and snared the ball as I arrived at the plate.
425.	NO-EMOTION	I tucked my shoulder down and leveled a defenseless Joe.
426.	NO-EMOTION	He went flying backwards and landed with a huge thud in the left-handed batter's box.
427.	NO-EMOTION	Upon hitting the ground, he pulled the ball out of his glove and into his bare hand and showed everyone he had held on to complete the double play.
428.	NO-EMOTION	When I asked him whether he was all right, he said he was and proceeded to tell me that he knew it was coming.
429.	NO-EMOTION	He saw the play unfolding but had no way to brace for it because of the high throw and the simultaneous arrival of me and the ball.
430.	NO-EMOTION	Oh well, how often does one see a collision at home plate anyway?
431.	NO-EMOTION	You just have to think though of the consequences when two people meet at one point in that vicious a nature.
432.	NO-EMOTION	Who can forget Ray Fosse and Pete Rose's encounter at home plate in the 12th inning of the 1970 All Star Game?
433.	NO-EMOTION	This play remains perdurably etched in baseball history as the greatest play at the plate of all time.
434.	NO-EMOTION	Jim Hickman lines a base hit to center, Amos Otis comes up firing to the plate, the third base coach, Leo Durocher waves Pete Rose home, the throw brings then Indians' catcher, Ray Fosse a few feet up the line, and then it happens.
435.	FEAR	Pete Rose knocks Ray Fosse into baseball lore and permanantly knocks his shoulder into a somewhat more precarious place.
436.	NO-EMOTION	Pete Rose scores the game-winning run and Ray Fosse, the Indians' seemingly promising beacon, is never the same ball player.
437.	NO-EMOTION	So, in the end, we held on to win by a score of 18-13.
438.	NO-EMOTION	Joe was fine after taking one of the hardest shots any catcher has ever taken in the six years we've been playing ball together.
439.	NO-EMOTION	That is probably the reason most leagues have banned the runner from destroying the catcher like that.
440.	HAPPINESS	Yes, injuries can happen but, as a former catcher, it's the most exhilarating play in sports.
441.	NO-EMOTION	There is nothing like being in a train wreck at home plate especially if you hang on to the ball for the out.
442.	NO-EMOTION	Joe said it doesn't happen that often so it doesn't bother him.
443.	NO-EMOTION	It would if it were a constant occurence but that was the first time this year that we had had a collision at home plate and probably the last.
444.	NO-EMOTION	There is usually one good hit each season and that is it.
445.	NO-EMOTION	Joe said the only sensation going through his body when he hit the ground was that he had to go to the bathroom badly.
446.	HAPPINESS	That was kind of funny.
447.	NO-EMOTION	It's not as if Joe has never gotten me before.
448.	NO-EMOTION	I remember it as though it were yesterday.
449.	NO-EMOTION	June 5th, 2003.
450.	NO-EMOTION	Joe was on third and there was a runner on second with one out in a 6-6 tie in the bottom of the 6th inning.
451.	NO-EMOTION	We were intentionally walking Ahsan to load the bases up.
452.	NO-EMOTION	As I threw one of the pitches back to Billy, Joe broke for home plate.
453.	NO-EMOTION	I screamed for Billy to throw it and he did.
454.	NO-EMOTION	I jumped in front of home plate and the ball deflected off my glove and Joe just crushed me. He bounced off me and rolled behind home plate.
455.	NO-EMOTION	I landed by the ball and picked it up with my bare hand.
456.	NO-EMOTION	I turned around and swiped at Joe and missed as he hit home plate with his foot and his whole team just raced to the plate and mobbed him as they won, 7-6.
457.	NO-EMOTION	Ahsan says he still remembers that play.
458.	NO-EMOTION	He says he and Joe knew we were loading the bases for their two worst hitters to get the game into extra innings so they devised a play that involved Joe's trying to steal home.
459.	NO-EMOTION	Ahsan told me that he remembers the collision mostly because the game was being played in the rain and we very rarely play when it's raining.
460.	NO-EMOTION	He saw us sprawled out on the ground and thought for sure Joe was out.
461.	NO-EMOTION	Then he saw the ball lying on the ground and screamed for Joe to touch home.
463.	DISGUST	I remember walking off the field disgusted with myself.
465.	NO-EMOTION	It was as if they had won the World Series.
466.	NO-EMOTION	They completely mobbed Joe and were bounding around home plate as if Joe were the king of baseball.
467.	NO-EMOTION	All right, that's all I want to say.
468.	NO-EMOTION	Good night my faithful blog acolytes.
469.	NO-EMOTION	I shall catch you later on when I am feeling like writing again.
470.	NO-EMOTION	My brother and I just went out to go for a bike ride.
471.	NO-EMOTION	I checked my bike tire, and though it was quite bent and warped, I was still able to go biking.
472.	HAPPINESS	I liked that, I am really happy to be able to ride again.
474.	NO-EMOTION	The reason I was at the bank was to check to see if Dad had deposited the 56 dollar Government GST cheque into my account yet.
475.	NO-EMOTION	What I did, to see, was check to see what my balance was.
476.	NO-EMOTION	It was 62 dollars, that's precisely 56 dollars more than I had.
477.	HAPPINESS	Bonus!
478.	NO-EMOTION	So I went to take out my 60 dollars, and it said I couldn't take it, because my available funds was limited to 6 dollars.
479.	ANGER	I was pretty bummed out, because it meant they put a hold on my cheque, I hate when they do that, what's the bloody point?
480.	ANGER	Especially when it's a bloody government cheque.
481.	NO-EMOTION	It wouldn't bother me much, except the last government cheque I deposited had no hold on it.
482.	NO-EMOTION	It was 122 dollars (money I promptly blew on DVD's and Food).
484.	NO-EMOTION	So, here I am with money RIGHT there that I can't get a hold of, and I really want to spend it at the Furmeet on Monday.
485.	NO-EMOTION	We furries are going to the Mongolian restaurant for a hangout from 7-9 before the meet, because sometimes we like to hang out and go bowling or swim for the meets.
489.	NO-EMOTION	I get the feeling Dad doesn't want Sam to go weird on him.
490.	NO-EMOTION	Like I said a while ago, Dad said he was gonna buy Sam a pound of weed, a 2-4 of beer, and a led Zeppelin album so that he had at least one normal kid.
492.	NO-EMOTION	He's pretty old fashioned, but not rude about it.
493.	DISGUST	He's not ignorant, just old fashioned (which is pretty damn rare.)
494.	NO-EMOTION	We think we're pretty close to letting Sam go with me but I would end up sleeping at Ixyao's again, because by the looks of it, Loth is spending the night in London again with his girlfriend.
496.	NO-EMOTION	Earlier today, I put on Elfenking - Seasonspeech, and mom asked me if I ever listened to radio music anymore.
499.	HAPPINESS	I pride myself on listening to a wide variety of music.
500.	HAPPINESS	I swelled with pride.
501.	NO-EMOTION	Scott moved out this morning.
502.	SADNESS	I was sad, but I helped him move his stuff.
503.	NO-EMOTION	Despite the large load of stuff he took, I barely notice a difference in the house.
504.	NO-EMOTION	The place looks just as full as it did when he was living here.
506.	NO-EMOTION	I've already told mom I'm moving on the weekend of the 26th, and I just need to get a hold of Andrea so I can make the plans formal.
507.	NO-EMOTION	Now I need to find a place to put all my stuff at Andrea's. I know my DVD shelf would have no problem finding a place in the livingroom, but the computer, the bed, the dresser, and my electronics would need to find a home in my room.
508.	NO-EMOTION	I could probably find a way to swing it, but it would be a little cramped.
509.	NO-EMOTION	There's no way I could put my chairs there, and I don't want to trash em, I would like to give them to a friend or something at the least.
510.	HAPPINESS	I love my chairs *sniffs*
512.	NO-EMOTION	I also tried to do my timetable, today was the first day I can set the timetable.
513.	NO-EMOTION	It took me a while to figure out how to do it, but I did finally figure it out, and I did what I could to keep Monday night and Tuesday morning open.
514.	NO-EMOTION	That way I can go to the Furmeets, Jason also did the same thing, he has Mondays off so he can go to the furmeet.
515.	HAPPINESS	That's funny, I think, that we love the furries so much that we're willing to schedule our schooling around the meets.
516.	HAPPINESS	Woohoo!
517.	NO-EMOTION	However, when I went to submit my timetable, I was asked to pay the rest of my tuition.
518.	NO-EMOTION	I was kind of confused.
519.	NO-EMOTION	as when I asked the representative, they said that as long as I paid my 400 dollars, I wouldn't have to worry about the rest of my costs until OSAP made a decision, and until then, I could go ahead, schedule, and do my thing.
520.	NO-EMOTION	I need to make another few calls, but mom's in Norwich and has the only phone that works right now.
521.	NO-EMOTION	It also said that I have to register for some student success thing, and I have to call in.
522.	NO-EMOTION	Same deal, I have the number written down on a piece of paper so I don't forget when the time comes.
523.	NO-EMOTION	I also have my MoCoMotion password and username right here, not to mention my OSAP access number, and all the numbers I need to call right here with me. I am PREPARED.
524.	NO-EMOTION	And since I put that I was living with mother, and she only makes 6000 a year, I can almost guarantee that I will get accepted for OSAP, and they said they'll pay 8700 for this year.
525.	HAPPINESS	which is crazy good, especially if I'm living with Andrea, who only asks for internet, hydro, and food.
526.	NO-EMOTION	For me, internet would be like 25 bucks, hydro, another 30 or 40, and food.
527.	HAPPINESS	well, I could splurge.
528.	NO-EMOTION	I do have to pay something like 300 dollars a semester for the Mohawk Brantford to Mohawk Hamilton bus.
530.	NO-EMOTION	And the government still owes me 680 dollars.
531.	NO-EMOTION	and they say for this semester, I only owe them 1044.12.
533.	HAPPINESS	Either way, I'm thinking it's looking pretty good.
537.	NO-EMOTION	Yeah, vulgar, I know, but even if I had a friend with benefits, I would go the way of Andrea and do it to get it out of the way.
538.	NO-EMOTION	So, tomorrow I am busy.
539.	NO-EMOTION	Sam and I are both working for Burgessville Rocks for Whitney.
540.	NO-EMOTION	I get to be ticket bitch, and I get more volunteer hours and experience.
541.	NO-EMOTION	Alphabeta for two years, and now this.
542.	NO-EMOTION	Try to tell me that it's not impressive to see on a resume.
543.	NO-EMOTION	Which I should print up next week, when I find the time, after I get the info.
544.	NO-EMOTION	I need to have them ready so I can be looking for a job In Brantford after school.
547.	NO-EMOTION	None of that for the Runa.
548.	NO-EMOTION	I finally feel a little more independent.
549.	NO-EMOTION	I am looking to drive more so I can get my G2, I am solid in my belief that I am going to Brantford on the 26th, I am no longer indecisive, I want to get away from the issue between my parents, and I am looking to be very assertive for college.
550.	NO-EMOTION	Here's a list of the things I need to do.
551.	NO-EMOTION	#1, print off the OSAP thing the government wants me to.
552.	NO-EMOTION	I just need it to get mom's signature, then I think I mail it to the government when they decide or something.
553.	NO-EMOTION	I need to do that ASAP.
554.	NO-EMOTION	After that, I then make my calls to mohawk to ask about the money issue, the tuition and my schedules.
556.	NO-EMOTION	#4, move to Andreas and get comfortable there while looking for an after school job.
557.	NO-EMOTION	#5 talk to the people concerning the shuttlebus from Brantford to Mohawk.
558.	NO-EMOTION	Problem is, I can't do any of these things right now, so I keep them all in mind, and become impatient to get access to a phone, and I am gonna look up info on the shuttlebus.
559.	NO-EMOTION	Courses just opened up, so it's not like I'm late, they've been open for a whole 12 hours, and I can register until mid September, so I've got some time, however, I don't want to wait, that's why I went on the site this morning to do it ASAP.
560.	SADNESS	So, tomorrow's gonna make me a little sad.
561.	NO-EMOTION	I have the choice to either go to this Burgessville Rocks thing, go to London to watch movies with the Furries, or go to Brantford with Jason to sling some haybales and make some more cash (oh yeah, Tim owes me like 30 bucks too, on top of the 60 in my bank) so apparently I do well with the cash.
562.	NO-EMOTION	Not to mention the 680.
563.	NO-EMOTION	I will be okay until I move to Andreas, and for a little while afterwards, I'm in no rush, but I want to be ahead of the crowd.
564.	NO-EMOTION	You know, do my thing, be independent.
565.	NO-EMOTION	I know I CAN do it, I just want college, that's my thing.
566.	NO-EMOTION	Anyway, the smart part of me says to go to Jason's, make some cash, get stronger, get ready and train my leg to be stronger (like I did on my bike.)
569.	NO-EMOTION	However, the loyal part of me says that since I made a promise to Whit, even though it's unpaid work, I should go to Burgessville.
570.	NO-EMOTION	I mean, I told her on July 25th, or somewhere around there, that I'd come help out, and I wasn't backing out this time.
571.	NO-EMOTION	Plus I get to see Whit, Sam, Will, and the whole High School Crew.
572.	SADNESS	I miss em all and they're the smartest, most responsible group I've ever been a part of.
573.	ANGER	However, the playful, devil-may-care part of me tells me to fuck em all and go to London to watch movies with the Furs.
575.	NO-EMOTION	In fact, I sent her an email, and she still hasn't responded, so I don't know when she'll be here.
576.	NO-EMOTION	I will be on all night waiting.
578.	NO-EMOTION	Flamers.
579.	NO-EMOTION	Not flamboyant Homosexuals, but people on message boards and forums.
580.	NO-EMOTION	People like a guy I know named Pisher, and Kuellere.
581.	NO-EMOTION	Both are people who go on the Boxofficemojo forums.
582.	NO-EMOTION	Just as an example, here's something he wrote.
584.	NO-EMOTION	Rondoze, I think I see the source of our misunderstanding.
587.	NO-EMOTION	It's a defensible opinion, however unproven.
588.	NO-EMOTION	So sorry to have misunderstand you, it would help if you learned how to write."
589.	DISGUST	People like him bug me, not because they disagree with me, but because when you disagree with them, they resort to insults, and we all know how men need to have big balls and can't lose to another man, people always fall into a fight, or as it's known online, a flame war.
590.	NO-EMOTION	I try to stay out of them, as I can't stand my intelligence being lowered to their level, but sometimes I just want to do what Jay and Silent Bob did.
591.	ANGER	go to their houses and smash their faces in because they like to aggravate.
592.	NO-EMOTION	just because they can.
593.	NO-EMOTION	When I go on a messageboard about movies, I like discussing things like which film was better, Pirates or Superman.
594.	HAPPINESS	I personally enjoyed Pirates more, but I thought Superman was far more artistically done with a fantastic story.
595.	DISGUST	Whereas you go on there, on one side there are people constantly saying that pirates sucked, and that nobody is allowed to like it because it sucked and it was horrible.
596.	DISGUST	etc. or you have the folks trying to tell you that Superman was horrible.
597.	NO-EMOTION	despite the fact that it made nearly 200 million dollars.
599.	DISGUST	It's disgusting that I have to feel relieved when I find a thread that has people calmly discussing sides of an argument.
600.	NO-EMOTION	Well, I'm gonna go post on a board and try to ignore the flames.
601.	NO-EMOTION	In case I don't see ya, good afternoon, good evening, and goodnight.
606.	NO-EMOTION	so im confuzed.
607.	NO-EMOTION	i dont know what i want outta life
608.	DISGUST	i dont like myself quite frankly i dislike myself very much, dont ask why cause i couldnt tell you.
609.	DISGUST	all i know is i suck (and im not looking for sympathy comments here)
610.	NO-EMOTION	im only writing this stuff down because when i see it in writing sometime i understand myself better
611.	DISGUST	i hate the word better
612.	HAPPINESS	why cant i just be happy with good enough?
613.	SADNESS	everything could ALWAYS be better so ill never be happy!
615.	FEAR	freaky.
616.	DISGUST	but wat the HECK does "delight yourself in the Lord and He will give you the desires of your heart", mean?
619.	NO-EMOTION	or even enough of those?
620.	DISGUST	i suck , completely and thouroughly suck
621.	NO-EMOTION	i feel like i constantly need a boyfriend.
623.	NO-EMOTION	i cant learn to be ok with myself alone and i dont want to have to rely on boys to make me feel like im important or worth living.
625.	DISGUST	ahhhhhhhhhhhhhhhhhhh why do i hate life?!
626.	HAPPINESS	i just wanna have fun and be happy and simple like all my friends.
627.	HAPPINESS	just giggle giggle giggle thats all they do everyday all day and all they need is a boyfriend and someone to laugh with.
628.	NO-EMOTION	i want to be that
632.	DISGUST	Terrorists make me SICK, they ought to all be horrifically detained, I believe it was the first time in my life I have had to resort to extreme racism.
633.	ANGER	Do you people not listen to the news or what?
635.	ANGER	Perhaps I am just being petty, but that did really annoy me. It absolutely outrages me as to how evil, and canniving these people are.
636.	FEAR	Imagine, transporting a bomb, fashioned out of a SPORTS DRINK, and triggering it with the simplistic flash of a disposable camera.
637.	SURPRISE	I just can't believe it.
638.	NO-EMOTION	I'm only going back now, should a member of my immediate family pass away.
639.	ANGER	Britain, has, evidently officially gone to the dogs if the so-called "prime minister" is in Mexico, whilst we could have been dealing with 3,500 innocent lives lost, on 10 different jetliners.
640.	HAPPINESS	So, I am thankful to still be alive.
